title,author,price,isbn,publishedDate,categoryName,stockQuantity,description,coverImageUrl
DSLs in Boo: Domain-Specific Languages in .NET,Oren Eini writing as Ayende Rahien,445,1933988606,01-01-2010,Microsoft .NET,24,"A general-purpose language like C# is designed to handle all programming tasks. By contrast, the structure and syntax of a Domain-Specific Language are designed to match a particular applications area. A DSL is designed for readability and easy progr...",https://s3.amazonaws.com/AKIAJC5RLADLUMVRPFDQ.book-thumb-images/rahien.jpg
JUnit Recipes,J. B. Rainsberger with contributions by Scott Stirling,990,1932394230,07-01-2004,Java,9,"When testing becomes a developer's habit good things tend to happen--good productivity, good code, and good job satisfaction. If you want some of that, there's no better way to start your testing habit, nor to continue feeding it, than with JUnit Rec...",https://s3.amazonaws.com/AKIAJC5RLADLUMVRPFDQ.book-thumb-images/rainsberger.jpg
wxPython in Action,Noel Rappin,709,1932394621,03-01-2006,Python,39,"wxPython is an open source GUI toolkit for the Python programming language. It offers productivity gains and useful features for any programmer, and is quickly gaining in popularity as a result. The only published source for the wxPython toolkit, co-...",https://s3.amazonaws.com/AKIAJC5RLADLUMVRPFDQ.book-thumb-images/rappin.jpg
Clojure in Action,Amit Rathore,927,1935182595,15-11-2011,Java,11,"Clojure is a modern implementation of Lisp for the JVM, ideally suited for general programming and specialized tasks like creating domain specific languages. Like Haskell and Scala, Clojure supports the functional style of programming. By combining f...",https://s3.amazonaws.com/AKIAJC5RLADLUMVRPFDQ.book-thumb-images/rathore.jpg
Scala in Action,Nilanjan Raychaudhuri,864,1935182757,04-09-2013,Java,35,nan...,https://s3.amazonaws.com/AKIAJC5RLADLUMVRPFDQ.book-thumb-images/raychaudhuri.jpg
Working with Objects,Trygve Reenskaug,496,134529308,08-01-1995,Object-Oriented Programming,21,"Working With Objects is the authoritative account of the highly successful OOram method for software analysis, design, development, maintenance and reuse. OOram has been fine-tuned over a decade on hundreds of projects by Trygve Reenskaug and his col...",https://s3.amazonaws.com/AKIAJC5RLADLUMVRPFDQ.book-thumb-images/reenskaug.jpg
PHP in Action,Dagfinn Reiersøl with Marcus Baker,583,1932394753,07-01-2007,PHP,45,"To keep programming productive and enjoyable, state-of-the-art practices and principles are essential. Object-oriented programming and design help manage complexity by keeping components cleanly separated. Unit testing helps prevent endless, exhausti...",https://s3.amazonaws.com/AKIAJC5RLADLUMVRPFDQ.book-thumb-images/reiersol.jpg
Secrets of the JavaScript Ninja,John Resig,454,193398869X,27-12-2012,Java,13,"JavaScript developers commonly rely on collections of reusable JavaScript code--written by themselves or by someone else at their company. Alternatively, they rely on code from a third party. But in all these cases they need to know how to either con...",https://s3.amazonaws.com/AKIAJC5RLADLUMVRPFDQ.book-thumb-images/resig.jpg
Microsoft Office Essentials,Ronny Richardson,792,132623129,07-01-1996,Business,13,"Many books on Microsoft Office try to cover every feature of the software. You don't use every feature, though. Microsoft Office Essentials simply covers the things you really want to know and skips over all those esoteric features that 99 out of 100...",https://s3.amazonaws.com/AKIAJC5RLADLUMVRPFDQ.book-thumb-images/richardson2.jpg
Swing,Matthew Robinson,495,1884777848,12-01-1999,Java,3,nan...,
Swing Second Edition,Chris Lee,706,193011088X,02-01-2003,Java,8,"This book builds on the successful approach of the first edition of Swing, once again taking the power and flexibility of Java's Swing library to its limits. Using a fast-paced style, it starts by introducing each of the Swing components and continue...",https://s3.amazonaws.com/AKIAJC5RLADLUMVRPFDQ.book-thumb-images/robinson2.jpg
The Awesome Power of Java Beans,Lawrence H. Rodrigues,427,1884777562,05-01-1998,Java,7,"Build your own bean  Or use one that's ready-made  The Awesome Power of Java Beans provides the details on both. Either way, the power of Java Beans is awesome: once created, your beans run anywhere-- ceven masquerading as an ActiveX control.    The ...",https://s3.amazonaws.com/AKIAJC5RLADLUMVRPFDQ.book-thumb-images/rodrigues.jpg
Personal Videoconferencing,Evan Rosen,578,013268327X,06-01-1996,Networking,41,"The first book on the most powerful communication tool since the development of the personal computer, Personal Videoconferencing will help you streamline your business and gain a competitive edge. It summarizes the experience of more than seventy co...",https://s3.amazonaws.com/AKIAJC5RLADLUMVRPFDQ.book-thumb-images/rosen.jpg
The Cloud at Your Service,Jothy Rosenberg,167,1935182528,22-11-2010,Internet,4,nan...,https://s3.amazonaws.com/AKIAJC5RLADLUMVRPFDQ.book-thumb-images/rosenberg.jpg
Implementing Elliptic Curve Cryptography,Michael Rosing,927,1884777694,11-01-1998,Theory,40,"Implementing Elliptic Curve Cryptography proceeds step-by-step to explain basic number theory, polynomial mathematics, normal basis mathematics and elliptic curve mathematics. With these in place, applications to cryptography are introduced. The book...",https://s3.amazonaws.com/AKIAJC5RLADLUMVRPFDQ.book-thumb-images/rosing.jpg
SOA Patterns,Arnon Rotem-Gal-Oz,420,1933988266,09-12-2012,SOA,11,"SOA   Service Oriented Architecture   has become the leading solution for complex, connected business systems. While it's easy to grasp the theory of SOA, implementing well-designed, practical SOA systems can be a difficult challenge. Developers and ...",https://s3.amazonaws.com/AKIAJC5RLADLUMVRPFDQ.book-thumb-images/rotem.jpg
Hello World!,Warren D. Sande,476,1933988495,03-01-2009,Programming,26,"Your computer won't respond when you yell at it. Why not learn to talk to your computer in its own language  Whether you want to write games, start a business, or you're just curious, learning to program is a great place to start. Plus, programming i...",https://s3.amazonaws.com/AKIAJC5RLADLUMVRPFDQ.book-thumb-images/sande.jpg
SCBCD Exam Study Kit,Paul Sanghera,944,1932394400,06-01-2005,Java,42,"There is probably no Java certification more valuable to you than Sun Certified Business Component Developer CX-310-090. To pass you need a readable, no-nonsense book focused like a laser beam on the exam goals. SCBCD Exam Study Kit is that book.    ...",https://s3.amazonaws.com/AKIAJC5RLADLUMVRPFDQ.book-thumb-images/sanghera.jpg
Portlets in Action,Ashish Sarin,586,1935182544,16-09-2011,Java,31,"A ""portal"" is a browser-based container populated by small applications called ""portlets"". Good portlets need to work independently, but also communicate with the portal, other portlets, and outside servers and information sources. Whether they're pa...",https://s3.amazonaws.com/AKIAJC5RLADLUMVRPFDQ.book-thumb-images/sarin.jpg
SWT/JFace in Action,Matthew Scarpino,198,1932394273,11-01-2004,Java,16,"SWT and JFace are Eclipse's graphical libraries. They enable you to build nimble and powerful Java GUIs--but this is only the beginning. With Draw2D and the Graphical Editing Framework, you can go beyond static applications and create full-featured e...",https://s3.amazonaws.com/AKIAJC5RLADLUMVRPFDQ.book-thumb-images/scarpino.jpg
OpenCL in Action,Matthew Scarpino,164,1617290173,14-11-2011,Programming,48,nan...,https://s3.amazonaws.com/AKIAJC5RLADLUMVRPFDQ.book-thumb-images/scarpino2.jpg
Multiprotocol over ATM,Andrew Schmidt,827,138892709,03-01-1998,Internet,50,"Networks constructed with current ATM protocol design standards exceed by far former network capabilities. Unfortunately, this new ATM power and flexibility come at the cost of greater complexity. With the detailed coverage of the entire set of proto...",https://s3.amazonaws.com/AKIAJC5RLADLUMVRPFDQ.book-thumb-images/schmidt.jpg
Dependency Injection in .NET,Mark Seemann,697,1935182501,10-03-2011,Microsoft .NET,14,"Dependency Injection (DI) is a software design technique emphasizing Separation of Concerns, Modularity, Extensibility and Testability. Applied well, it enables programmers to successfully deal with complexity in software and add new features to exis...",https://s3.amazonaws.com/AKIAJC5RLADLUMVRPFDQ.book-thumb-images/seemann.jpg
Java 3D Programming,Daniel Selman,455,1930110359,03-01-2002,Java,15,"Java 3D Programming steps programmers through the important design and implementation phases of developing a successful Java 3D application. The book provides invaluable guidance on whether to use Java 3D, user interface design, geometry creation, sc...",https://s3.amazonaws.com/AKIAJC5RLADLUMVRPFDQ.book-thumb-images/selman.jpg
Liferay in Action,Richard Sezov,698,193518282X,20-09-2011,Internet,20,nan...,https://s3.amazonaws.com/AKIAJC5RLADLUMVRPFDQ.book-thumb-images/sezov.jpg
JSP Tag Libraries,Gal Shachor,867,193011009X,05-01-2001,Java,17,JSP Tag Libraries is a bible for serious JSP developers. The reader will become acquainted with the world of custom JSP tags--new JSP technology that is beginning to have an enormous impact on the way people are developing JSP.    JSP tags are Java c...,https://s3.amazonaws.com/AKIAJC5RLADLUMVRPFDQ.book-thumb-images/shachor.jpg
Instant Messaging in Java,Iain Shigeoka,784,1930110464,03-01-2002,Internet,45,"Instant Messaging has exploded into the online world and is a wildly popular service of the largest Internet Service Providers (ISP) like AOL with AOL Instant Messenger, MSN with Microsoft Messenger, and Yahoo with Yahoo Messenger. Millions of Intern...",https://s3.amazonaws.com/AKIAJC5RLADLUMVRPFDQ.book-thumb-images/shigeoka.jpg
Java Applets and Channels Without Programming,Ronny Richardson,318,1884777392,12-01-1999,Java,2,"If you want to use Java to enhance your Web site, you have two choices: you can write the Java applet yourself or you can find an already written Java applet that meets your needs. If you prefer not to do the writing yourself, then Java Applets and C...",https://s3.amazonaws.com/AKIAJC5RLADLUMVRPFDQ.book-thumb-images/shoffner.jpg
PowerShell in Practice,Richard Siddaway,631,1935182005,06-08-2010,Microsoft .NET,29,"Whether you're optimizing performance, automating tasks, or exploiting software features, efficiency is the key to a system administrator's success. Anything that saves a few cycles is a welcome addition to your toolbox; Windows PowerShell has the po...",https://s3.amazonaws.com/AKIAJC5RLADLUMVRPFDQ.book-thumb-images/siddaway.jpg
PowerShell and WMI,Richard Siddaway,534,1617290114,30-04-2012,Microsoft .NET,32,nan...,https://s3.amazonaws.com/AKIAJC5RLADLUMVRPFDQ.book-thumb-images/siddaway2.jpg
Making Sense of Java,Bruce Simpson,953,132632942,06-01-1996,Java,46,"The meteoric rise of interest in Java, and the simultaneous rise in Java-related hype, make this book's no-nonsense evaluation essential reading for all levels of professionals, from managers to programmers. Making Sense of Java clearly and concisely...",https://s3.amazonaws.com/AKIAJC5RLADLUMVRPFDQ.book-thumb-images/simpson.jpg
C++/CLI in Action,Nishant Sivakumar,667,1932394818,04-01-2007,Microsoft,10,"Developers initially welcomed Microsoft   s Managed C++ for .NET, but the twisted syntax made it difficult to use. Its much-improved replacement, C++/CLI, now provides an effective bridge between the native and managed programming worlds. Using this ...",https://s3.amazonaws.com/AKIAJC5RLADLUMVRPFDQ.book-thumb-images/sivakumar.jpg
C# in Depth,Jon Skeet,462,1933988363,04-01-2008,Microsoft .NET,6,"In programming, there's no substitute for knowing your stuff. In versions 2 and 3, C# introduces new concepts such as lambda expressions and implicit typing that make the language more flexible and give you more power. Using Language INtegrated Query...",https://s3.amazonaws.com/AKIAJC5RLADLUMVRPFDQ.book-thumb-images/skeet.jpg
"C# in Depth, Second Edition",Jon Skeet,695,1935182471,,Microsoft .NET,44,"C# has changed since it was first introduced   a lot! With generics, lambda expressions, dynamic typing, LINQ, iterator blocks and many other features, C# is more expressive than ever. However, you can't get the most out of the language unless you kn...",https://s3.amazonaws.com/AKIAJC5RLADLUMVRPFDQ.book-thumb-images/skeet2.jpg
Magical A-Life Avatars,Peter Small,669,1884777589,12-01-2000,Internet,36,"Here's a book guaranteed to inspire your creativity and get you looking at the Internet and the World Wide Web with new eyes. Modeling its vision on evolutionary biology, Magical A-Life Avatars uses the example environment of Macromedia Director to c...",https://s3.amazonaws.com/AKIAJC5RLADLUMVRPFDQ.book-thumb-images/small.jpg
Becoming Agile,Greg Smith,127,1933988258,05-01-2009,Software Engineering,6,"Agile principles have been a breath of fresh air to many development teams stuck in the middle of a rigid, process-driven environment. Unfortunately, it's not so easy to bring Agile into an existing organization with established people and practices....",https://s3.amazonaws.com/AKIAJC5RLADLUMVRPFDQ.book-thumb-images/smith.jpg
ActiveMQ in Action,Bruce Snyder,657,1933988940,31-03-2011,Java,31,"Modern distributed architectures require a secure, reliable way to exchange messages in asynchronous, loosely-coupled systems. For Java developers, the Java Message Service (JMS) provides that core functionality. The Apache ActiveMQ message broker is...",https://s3.amazonaws.com/AKIAJC5RLADLUMVRPFDQ.book-thumb-images/snyder.jpg
Implementing PeopleSoft Financials,Early Stephens,815,138411808,01-01-1997,Business,18,"The PeopleSoft promise is enticing: Here's a way for your company to implement a complete and flexible financial infrastructure in a client/server environment without the burdens of low-level programming. But, implementation remains complex and requi...",https://s3.amazonaws.com/AKIAJC5RLADLUMVRPFDQ.book-thumb-images/stephens.jpg
SQL Server DMVs in Action,Ian W. Stirk,912,1935182730,05-09-2011,Microsoft .NET,44,"SQL Server DMVs in Action is a practical guide that shows you how to obtain, interpret, and act on the information captured by DMVs to keep your system in top shape. The samples provided in this book will help you master DMVs and also give you a test...",https://s3.amazonaws.com/AKIAJC5RLADLUMVRPFDQ.book-thumb-images/stirk.jpg
Scala in Depth,Joshua D. Suereth,306,1935182706,14-05-2012,Java,29,"Scala is a unique and powerful new programming language for the JVM. Blending the strengths of the Functional and Imperative programming models, Scala is a great tool for building highly concurrent applications without sacrificing the benefits of an ...",https://s3.amazonaws.com/AKIAJC5RLADLUMVRPFDQ.book-thumb-images/suereth.jpg
JMX in Action,Benjamin G. Sullins,806,1930110561,09-01-2002,Java,3,"With Java Management Extensions (JMX), you can configure, manage and monitor your Java applications at run-time, as well as break your applications into components that can be swapped out. JMX provides a window into an application's state and its beh...",https://s3.amazonaws.com/AKIAJC5RLADLUMVRPFDQ.book-thumb-images/sullins.jpg
EJB Cookbook,Benjamin G. Sullins,455,1930110944,05-01-2003,Java,50,"The EJB Cookbook is a resource for the practicing EJB developer. It is a systematic collection of EJB 'recipes'. Each recipe describes a practical problem and its background; it then shows the code that  solves it, and ends with a detailed discussion...",https://s3.amazonaws.com/AKIAJC5RLADLUMVRPFDQ.book-thumb-images/sullins2.jpg
"GWT in Action, Second Edition",Adam Tacy,180,1935182846,21-01-2013,Java,31,nan...,https://s3.amazonaws.com/AKIAJC5RLADLUMVRPFDQ.book-thumb-images/tacy.jpg
"JUnit in Action, Second Edition",Petar Tahchiev,566,1935182021,07-01-2010,Java,25,"When JUnit was first introduced a decade ago by Kent Beck and Erich Gamma, the Agile movement was in its infancy, ""Test Driven Development"" was unknown, and unit testing was just starting to move into the typical developer's vocabulary. Today, most d...",https://s3.amazonaws.com/AKIAJC5RLADLUMVRPFDQ.book-thumb-images/tahchiev.jpg
Bitter Java,Bruce A. Tate,708,193011043X,03-01-2002,Java,4,"It is a well-known fact that most software projects fail. Drawing important lessons from common failures is the goal of Bitter Java.    Reusing design patterns is not enough for success: patterns are like partial maps of dangerous terrain. They help,...",https://s3.amazonaws.com/AKIAJC5RLADLUMVRPFDQ.book-thumb-images/tate.jpg
Bitter EJB,Bruce Tate,373,1930110952,05-01-2003,Java,29,"In Bitter EJB, Bruce Tate and his co-authors continue the entertaining and engaging writing style of relating true-life adventure sport experiences to antipattern themes established in Bruce's first book, the best selling Bitter Java.    This more ad...",https://s3.amazonaws.com/AKIAJC5RLADLUMVRPFDQ.book-thumb-images/tate2.jpg
Spring Batch in Action,Arnaud Cogoluegnes,586,1935182951,10-01-2011,In Action,36,nan...,https://s3.amazonaws.com/AKIAJC5RLADLUMVRPFDQ.book-thumb-images/templier.jpg
JDK 1.4 Tutorial,Gregory M. Travis,191,1930110456,03-01-2002,Java,21,"Java is a success. It is now used across the programming landscape, from embedded devices to enterprise-class distributed systems. As Java's use increases, the pressure grows for it to expand to meet the diverse needs of the developer communities. Th...",https://s3.amazonaws.com/AKIAJC5RLADLUMVRPFDQ.book-thumb-images/travis.jpg
iPhone and iPad in Action,Brandon Trebitowski,570,1935182587,08-01-2010,Mobile Technology,2,"This hands-on tutorial will help you master iPhone/iPad development using the native iPhone SDK. It guides you from setting up dev tools like Xcode and Interface Builder, through coding your first app, all the way to selling in the App Store.    Usin...",https://s3.amazonaws.com/AKIAJC5RLADLUMVRPFDQ.book-thumb-images/trebitowski.jpg
SQL Server 2005 Reporting Services in Action,Bret Updegraff,910,1932394761,11-01-2006,Microsoft,28,"Reports are the lifeline of business, so a good reporting environment is a big deal. With a powerful tool like Microsoft Reporting Services, .NET developers can add reporting to any type of application, regardless of its target platform or developmen...",https://s3.amazonaws.com/AKIAJC5RLADLUMVRPFDQ.book-thumb-images/updegraff.jpg
Ten Years of UserFriendly.Org,"JD ""Illiad"" Frazer",511,1935182129,12-01-2008,Miscellaneous,14,"For over 10 years, UserFriendly has been entertaining geeks of all stripes with its daily dose of humor, social commentary, and occasionally absurd observations about the world of technology. Loyal UserFriendly fans   UFies   have been asking for a B...",https://s3.amazonaws.com/AKIAJC5RLADLUMVRPFDQ.book-thumb-images/userfriendly.jpg
Graphics Programming with Perl,Martien Verbruggen,665,1930110022,05-01-2002,Computer Graphics,41,An increasing number of tasks in application programming and web design requires creating and manipulating graphics. Perl is a powerful and flexible language that is not commonly associated with graphics programming. The speed of developing in Perl p...,https://s3.amazonaws.com/AKIAJC5RLADLUMVRPFDQ.book-thumb-images/verbruggen.jpg
RabbitMQ in Action,Alvaro Videla,754,1935182978,20-04-2012,Software Engineering,45,nan...,https://s3.amazonaws.com/AKIAJC5RLADLUMVRPFDQ.book-thumb-images/videla.jpg
XDoclet in Action,Craig Walls,259,1932394052,11-01-2003,XML,30,"Are you tired of writing the same Java code, over and over again  XDoclet will take the burden of repetitive development tasks off your shoulders by automating them. XDoclet is a metadata-driven, code generation engine for Java. Starting from simple ...",https://s3.amazonaws.com/AKIAJC5RLADLUMVRPFDQ.book-thumb-images/walls.jpg
Spring in Action,Craig Walls,169,1932394354,02-01-2005,Java,20,"Spring is a fresh breeze blowing over the Java landscape. Based on a design principle called Inversion of Control, Spring is a powerful but lightweight J2EE framework that does not require the use of EJBs. Spring greatly reduces the complexity of usi...",https://s3.amazonaws.com/AKIAJC5RLADLUMVRPFDQ.book-thumb-images/walls2.jpg
"Spring in Action, Second Edition",Craig Walls with Ryan Breidenbach,430,1933988134,08-01-2007,Java,49,"Spring is a fresh breeze blowing over the Java landscape. Based on the principles of dependency injection, interface-oriented design, and aspect-oriented programming, Spring combines enterprise application power with the simplicity of plain-old Java ...",https://s3.amazonaws.com/AKIAJC5RLADLUMVRPFDQ.book-thumb-images/walls3.jpg
"Spring in Action, Third Edition",Craig Walls,112,1935182358,21-06-2011,Java,26,"A few years back, Spring arrived as is a fresh breeze blowing over the Java landscape. Based on the principles of dependency injection, interface-oriented design, and aspect-oriented programming, Spring combines enterprise application power with the ...",https://s3.amazonaws.com/AKIAJC5RLADLUMVRPFDQ.book-thumb-images/walls4.jpg
Spring in Practice,Willie Wheeler with Joshua White,726,1935182056,05-09-2013,Java,28,"For enterprise Java developers, Spring Framework provides remarkable improvements in developer productivity, runtime performance, and overall application quality. Its unique blend of a complete, lightweight container that allows you to build a comple...",https://s3.amazonaws.com/AKIAJC5RLADLUMVRPFDQ.book-thumb-images/wheeler.jpg
Java 2 Micro Edition,James P. White,181,1930110332,03-01-2002,Java,46,"Java2, Micro Edition (J2ME) is a technology defined by many specifications. These specifications help J2ME address the diverse needs of this wide spectrum of consumer products. This guide describes the architecture of J2ME and demonstrates the variou...",https://s3.amazonaws.com/AKIAJC5RLADLUMVRPFDQ.book-thumb-images/white.jpg
SharePoint 2010 Workflows in Action,Phil Wicklund,771,1935182714,02-07-2011,Microsoft .NET,25,"You can use SharePoint 2010 workflows to transform a set of business processes into working SharePoint applications. For that task, a power user gets prepackaged workflows, wizards, and design tools, and a programmer benefits from Visual Studio to ha...",https://s3.amazonaws.com/AKIAJC5RLADLUMVRPFDQ.book-thumb-images/wicklund.jpg
SharePoint 2010 Web Parts in Action,Wictor Wilén,248,1935182773,24-04-2011,Microsoft .NET,42,If you look at a SharePoint application you'll find that most of its active components are Web Parts. SharePoint 2010 includes dozens of prebuilt Web Parts that you can use. It also provides an API that lets you build custom Web Parts using C# or VB....,https://s3.amazonaws.com/AKIAJC5RLADLUMVRPFDQ.book-thumb-images/wilen.jpg
C++ Concurrency in Action,Anthony Williams,523,1933988770,24-02-2012,Microsoft .NET,32,It seems like we're all being asked to multi-task more than ever   and our computers are no exception to this trend. Multiple processors with multiple cores running multiple threads is quickly becoming the norm. C++ developers will have to master the...,https://s3.amazonaws.com/AKIAJC5RLADLUMVRPFDQ.book-thumb-images/williams.jpg
Java Servlets by Example,Alan R. Williamson,433,188477766X,12-01-2002,Java,35,"Although CGI scripts provide 80% of today's server side processing, they are slow, inefficient, and memory-hungry. A new species is evolving to take their place, one which is lean, fast, portable, and easy to maintain: Java servlets.    Servlets are ...",https://s3.amazonaws.com/AKIAJC5RLADLUMVRPFDQ.book-thumb-images/williamson.jpg
XML Programming with VB and ASP,Mark Wilson,722,1884777872,12-01-1999,XML,34,"Here's a book that shows you when and how to use XML from both a programming and business perspective. Laden with source code, XML Programming with VB and ASP helps you build solutions that are flexible, future-proof, and self-describing. It will hel...",https://s3.amazonaws.com/AKIAJC5RLADLUMVRPFDQ.book-thumb-images/wilson.jpg
Oracle8i Database Administration,Noel Yuhanna,824,1884777783,11-01-1999,Client-Server,24,"Databases are growing larger, and the use of distributed databases is on the rise. Oracle8i Database Administration addresses some of the most common yet complex issues that are faced by DBAs around the world.    Oracle has the largest market share i...",https://s3.amazonaws.com/AKIAJC5RLADLUMVRPFDQ.book-thumb-images/yuhanna.jpg
The Engaging Web,Gabe Zichermann,623,9.78E+12,,Web Development,42,"Games are the fastest-growing and stickiest form of entertainment. For a website, games offer powerful potential to acquire new users, build engagement, and enhance revenue. Implementing games in a website can be complicated, though. There are hundre...",https://s3.amazonaws.com/AKIAJC5RLADLUMVRPFDQ.book-thumb-images/zichermann.jpg
Enterprise OSGi In Action,Holly Cummins,715,1617290130,,Databases,37,nan...,https://s3.amazonaws.com/AKIAJC5RLADLUMVRPFDQ.book-thumb-images/cummins.jpg
"Ext JS in Action, Second Edition",Jesus Garcia,783,1617290327,02-04-2014,Databases,6,nan...,https://s3.amazonaws.com/AKIAJC5RLADLUMVRPFDQ.book-thumb-images/garcia3.jpg
"Android in Action, Third Edition",W. Frank Ableson,943,1617290505,15-11-2011,Computer Science,42,nan...,https://s3.amazonaws.com/AKIAJC5RLADLUMVRPFDQ.book-thumb-images/ableson3.jpg
Arduino in Action,Martin Evans,651,1617290246,30-05-2013,Databases,31,"Whether you want to build an autonomous robot, automate your home electronics, or just automatically tweet when the bread is ready, you can do it with Arduino. Arduino is an inexpensive, easy-to-use, open source hardware and software platform. It sup...",https://s3.amazonaws.com/AKIAJC5RLADLUMVRPFDQ.book-thumb-images/mevans.jpg
