title,author,price,isbn,publishedDate,categoryName,stockQuantity,description,coverImageUrl
Unlocking Android,W. Frank Ableson,520,1933988673,04-01-2009,Open Source,31,"Android is an open source mobile phone platform based on the Linux operating system and developed by the Open Handset Alliance, a consortium of over 30 hardware, software and telecom companies that focus on open standards for mobile devices. Led by s...",https://s3.amazonaws.com/AKIAJC5RLADLUMVRPFDQ.book-thumb-images/ableson.jpg
"Android in Action, Second Edition",W. Frank Ableson,350,1935182722,14-01-2011,Java,27,"When it comes to mobile apps, Android can do almost anything   and with this book, so can you! Android runs on mobile devices ranging from smart phones to tablets to countless special-purpose gadgets. It's the broadest mobile platform available.    A...",https://s3.amazonaws.com/AKIAJC5RLADLUMVRPFDQ.book-thumb-images/ableson2.jpg
Specification by Example,Gojko Adzic,730,1617290084,06-03-2011,Software Engineering,17,nan...,https://s3.amazonaws.com/AKIAJC5RLADLUMVRPFDQ.book-thumb-images/adzic.jpg
Flex 3 in Action,Tariq Ahmed with Jon Hirschi,614,1933988746,02-02-2009,Internet,17,"New web applications require engaging user-friendly interfaces   and the cooler, the better. With Flex 3, web developers at any skill level can create high-quality, effective, and interactive Rich Internet Applications (RIAs) quickly and easily. Flex...",https://s3.amazonaws.com/AKIAJC5RLADLUMVRPFDQ.book-thumb-images/ahmed.jpg
Flex 4 in Action,Tariq Ahmed,115,1935182420,15-11-2010,Internet,20,"Using Flex, you can create high-quality, effective, and interactive Rich Internet Applications (RIAs) quickly and easily. Flex removes the complexity barrier from RIA development by offering sophisticated tools and a straightforward programming langu...",https://s3.amazonaws.com/AKIAJC5RLADLUMVRPFDQ.book-thumb-images/ahmed2.jpg
Collective Intelligence in Action,Satnam Alag,633,1933988312,10-01-2008,Internet,30,"There's a great deal of wisdom in a crowd, but how do you listen to a thousand people talking at once  Identifying the wants, needs, and knowledge of internet users can be like listening to a mob.    In the Web 2.0 era, leveraging the collective powe...",https://s3.amazonaws.com/AKIAJC5RLADLUMVRPFDQ.book-thumb-images/alag.jpg
Zend Framework in Action,Rob Allen,716,1933988320,12-01-2008,Web Development,31,"From rather humble beginnings as the Personal Home Page scripting language, PHP has found its way into almost every server, corporation, and dev shop in the world. On an average day, somewhere between 500,000 and 2 million coders do something in PHP....",https://s3.amazonaws.com/AKIAJC5RLADLUMVRPFDQ.book-thumb-images/allen.jpg
Flex on Java,Bernerd Allmon,327,1933988797,15-10-2010,Internet,33,"In the demo, a hip designer, a sharply-dressed marketer, and a smiling, relaxed developer sip lattes and calmly discuss how Flex is going to make customers happy and shorten the workday   all while boosting the bottom line. The software systems they'...",https://s3.amazonaws.com/AKIAJC5RLADLUMVRPFDQ.book-thumb-images/allmon.jpg
Griffon in Action,Andres Almiray,462,1935182234,06-04-2012,Java,20,"Although several options exist for interface development in Java, even popular UI toolkits like Swing have been notoriously complex and difficult to use. Griffon, an agile framework that uses Groovy to simplify Swing, makes UI development dramaticall...",https://s3.amazonaws.com/AKIAJC5RLADLUMVRPFDQ.book-thumb-images/almiray.jpg
OSGi in Depth,Alexandre de Castro Alves,643,193518217X,12-12-2011,Java,12,"A good application framework greatly simplifies a developer's task by providing reusable code modules that solve common, tedious, or complex tasks. Writing a great framework requires an extraordinary set of skills-ranging from deep knowledge of a pro...",https://s3.amazonaws.com/AKIAJC5RLADLUMVRPFDQ.book-thumb-images/alves.jpg
Flexible Rails,Peter Armstrong,702,1933988509,01-01-2008,Web Development,19,"Rails is a fantastic tool for web application development, but its Ajax-driven interfaces stop short of the richness you gain with a tool like Adobe Flex. Simply put, Flex is the most productive way to build the UI of rich Internet applications, and ...",https://s3.amazonaws.com/AKIAJC5RLADLUMVRPFDQ.book-thumb-images/armstrong.jpg
Hello! Flex 4,Peter Armstrong,374,1933988762,11-01-2009,Internet,50,"With Flex 4 you can easily add color and life to your web applications by introducing dynamic user features, slick transitions, and eye-catching animations. Flex also provides powerful data handling capabilities so you can build industrial-strength a...",https://s3.amazonaws.com/AKIAJC5RLADLUMVRPFDQ.book-thumb-images/armstrong3.jpg
Coffeehouse,Levi Asher,882,1884777384,07-01-1997,Miscellaneous,23,"Coffeehouse is an anthology of stories, poems and essays originally published on the World Wide Web. The purpose is to capture the zeitgeist of the web's creative community, and to give readers a chance to enjoy some of the best and most notable orig...",https://s3.amazonaws.com/AKIAJC5RLADLUMVRPFDQ.book-thumb-images/asher.jpg
Team Foundation Server 2008 in Action,Jamil Azher,972,1933988592,12-01-2008,Microsoft .NET,19,"In complex software projects, managing the development process can be as critical to success as writing the code itself. A project may involve dozens of developers, managers, architects, testers, and customers, hundreds of builds, and thousands of op...",https://s3.amazonaws.com/AKIAJC5RLADLUMVRPFDQ.book-thumb-images/azher.jpg
Brownfield Application Development in .NET,Kyle Baley,334,1933988711,16-04-2010,Microsoft,37,"It's easy to get excited about building a new software project from scratch. So-called ""greenfield"" projects often involve learning new technology and the opportunity for experimentation. Working on established software projects may seem less glamoro...",https://s3.amazonaws.com/AKIAJC5RLADLUMVRPFDQ.book-thumb-images/baley.jpg
MongoDB in Action,Kyle Banker,780,1935182870,12-12-2011,Next Generation Databases,41,"MongoDB is a document-oriented database that's highly scalable and delivers very high-performance, especially with massive data sets that need to be spread across multiple servers. It blends the things you expect with any database   like indexing, qu...",https://s3.amazonaws.com/AKIAJC5RLADLUMVRPFDQ.book-thumb-images/banker.jpg
Distributed Application Development with PowerBuilder 6.0,Michael J. Barlotta,494,1884777686,06-01-1998,PowerBuilder,15,Distributed Application Development with PowerBuilder 6.0 is a vital source for the PowerBuilder programmer; it provides the sort of detailed coverage of Distributed PowerBuilder that you can find nowwhere else.    The book opens with a discussion of...,
Jaguar Development with PowerBuilder 7,Michael Barlotta,466,1884777864,08-01-1999,PowerBuilder,23,Jaguar Development with PowerBuilder 7 is the definitive guide to distributed application development with PowerBuilder. It is the only book dedicated to preparing PowerBuilder developers for Jaguar applications and has been approved by Sybase engine...,https://s3.amazonaws.com/AKIAJC5RLADLUMVRPFDQ.book-thumb-images/barlotta2.jpg
Taming Jaguar,Michael J. Barlotta,731,1884777686,07-01-2000,PowerBuilder,44,"Taming Jaguar is part of the PowerBuilder Developer's series, which includes Distributed Application Development with PowerBuilder 6 and Jaguar Development with PowerBuilder 7.    An application server is the heart of your enterprise computing archit...",https://s3.amazonaws.com/AKIAJC5RLADLUMVRPFDQ.book-thumb-images/barlotta3.jpg
3D User Interfaces with Java 3D,Jon Barrilleaux,162,1884777902,08-01-2000,Java,4,"3D User Interfaces with Java 3D is a practical guide for providing next-generation applications with 3D user interfaces for manipulation of in-scene objects. Emphasis is on standalone and web-based business applications, such as for online sales and ...",https://s3.amazonaws.com/AKIAJC5RLADLUMVRPFDQ.book-thumb-images/barrilleaux.jpg
Hibernate in Action,Christian Bauer,756,193239415X,08-01-2004,Java,3,Hibernate practically exploded on the Java scene. Why is this open-source tool so popular  Because it automates a tedious task: persisting your Java objects to a relational database. The inevitable mismatch between your object-oriented code and the r...,https://s3.amazonaws.com/AKIAJC5RLADLUMVRPFDQ.book-thumb-images/bauer.jpg
Hibernate in Action (Chinese Edition),Christian Bauer,288,ISBN155681,06-01-1999,Java,44,nan...,https://s3.amazonaws.com/AKIAJC5RLADLUMVRPFDQ.book-thumb-images/bauer-cn.jpg
Java Persistence with Hibernate,Christian Bauer,449,1932394885,11-01-2006,Java,11,"Persistence -- the ability of data to outlive an instance of a program -- is central to modern applications. Hibernate, the most popular Java persistence tool, provides automatic and transparent object/relational mapping so it's a snap to work with S...",https://s3.amazonaws.com/AKIAJC5RLADLUMVRPFDQ.book-thumb-images/bauer2.jpg
JSTL in Action,Shawn Bayern,771,1930110529,07-01-2002,Internet,27,"JSTL is an important simplification of the Java web platform. With JSTL, page authors can now write dynamic pages using standard HTML-like tags and an easy-to-learn expression language. JSTL is a standard from the Java Community Process, and its expr...",https://s3.amazonaws.com/AKIAJC5RLADLUMVRPFDQ.book-thumb-images/bayern.jpg
iBATIS in Action,Clinton Begin,241,1932394826,01-01-2007,Web Development,1,"Unlike some complex and invasive persistence solutions, iBATIS keeps O/RM clean and simple. It is an elegant persistence framework that maps classes to SQL statements and keeps the learning curve flat. The iBATIS approach makes apps easy to code, tes...",https://s3.amazonaws.com/AKIAJC5RLADLUMVRPFDQ.book-thumb-images/begin.jpg
Designing Hard Software,Douglas W. Bennett,325,133046192,02-01-1997,Object-Oriented Programming,27,"Have you ever heard, ""I can't define a good design but I know one when I see it""  Designing Hard Software discusses ways to develop software system designs that have the same tangibility and visibility as designs for hard objects like buildings or co...",
Hibernate Search in Action,Emmanuel Bernard,177,1933988649,21-12-2008,Java,7,"Good search capability is one of the primary demands of a business application. Engines like Lucene provide a great starting point, but with complex applications it can be tricky to implement. It's tough to keep the index up to date, deal with the mi...",https://s3.amazonaws.com/AKIAJC5RLADLUMVRPFDQ.book-thumb-images/bernard.jpg
jQuery in Action,Bear Bibeault,476,1933988355,01-01-2008,Web Development,8,A really good web development framework anticipates your needs. jQuery does more   it practically reads your mind. Developers fall in love with this JavaScript library the moment they see 20 lines of code reduced to three. jQuery is concise and reada...,https://s3.amazonaws.com/AKIAJC5RLADLUMVRPFDQ.book-thumb-images/bibeault.jpg
"jQuery in Action, Second Edition",Bear Bibeault,994,1935182323,06-01-2010,Java,16,A really good web development framework anticipates your needs. jQuery does more   it practically reads your mind. Developers fall in love with this JavaScript library the moment they see 20 lines of code reduced to three. jQuery is concise and reada...,https://s3.amazonaws.com/AKIAJC5RLADLUMVRPFDQ.book-thumb-images/bibeault2.jpg
Building Secure and Reliable Network Applications,Kenneth P. Birman,494,1884777295,01-01-1996,Networking,49,"As the ""network is the computer"" slogan becomes reality so reliability and security of networked applications become more important. Not only are hospitals, air traffic control systems, and telephone networks becoming more networked, but business app...",https://s3.amazonaws.com/AKIAJC5RLADLUMVRPFDQ.book-thumb-images/birman.jpg
Ruby for Rails,David A. Black,370,1932394699,05-01-2006,Web Development,32,"Ruby for Rails helps Rails developers achieve Ruby mastery. Each chapter deepens your Ruby knowledge and shows you how it connects to Rails. You   ll gain confidence working with objects and classes and learn how to leverage Ruby   s elegant, express...",https://s3.amazonaws.com/AKIAJC5RLADLUMVRPFDQ.book-thumb-images/black.jpg
The Well-Grounded Rubyist,David A. Black,822,1933988657,04-01-2009,Programming,14,"Interest in Ruby has exploded. Developers discovering this elegant, dynamic language quickly learn that Ruby is a powerful alternative to traditional static languages like Java or C++. It runs in most operating environments and can handle virtually a...",https://s3.amazonaws.com/AKIAJC5RLADLUMVRPFDQ.book-thumb-images/black2.jpg
Website Owner's Manual,Paul A. Boag,672,1933988452,10-01-2009,Internet,8,"Just because you're responsible for your organization's web presence doesn't mean you know how to build a website. The job of planning, launching, and managing a site often falls to people who have little or no experience in web design or development...",https://s3.amazonaws.com/AKIAJC5RLADLUMVRPFDQ.book-thumb-images/boag.jpg
ASP.NET 4.0 in Practice,Daniele Bochicchio,714,1935182463,15-05-2011,Microsoft .NET,40,"ASP.NET is an established technology to build web applications using Microsoft products. It drives a number of enterprise-level web sites around the world, but it can be scaled for projects of any size. The new version 4.0 is an evolutionary step: yo...",https://s3.amazonaws.com/AKIAJC5RLADLUMVRPFDQ.book-thumb-images/bochicchio.jpg
Hello! Python,Anthony Briggs,986,1935182080,13-02-2012,Python,30,"Learn Python the fast and fun way! Hello! Python is a fully-illustrated, project-driven tutorial designed to get you up and running with Python, no experience required. It's full of projects that help you learn the way most programmers do   one step ...",https://s3.amazonaws.com/AKIAJC5RLADLUMVRPFDQ.book-thumb-images/briggs.jpg
PFC Programmer's Reference Manual,Richard Brooks,523,1884777554,06-01-1998,PowerBuilder,28,PFC Programmers' Reference Manual provides information that should prove indispensible for the PowerBuilder programmer trying to learn the PowerBuilder Foundation Classes. It lists all of the objects and functions that they might use for a project wi...,https://s3.amazonaws.com/AKIAJC5RLADLUMVRPFDQ.book-thumb-images/brooks.jpg
Graphics File Formats,C. Wayne Brown,491,133034054,06-01-1995,Computer Graphics,38,Graphics File Formats is a comprehensive guide to the file formats used in computer graphics and related areas. It discusses implementation and design of file formats in a readable style focusing on the basic issues important for the evaluation or de...,https://s3.amazonaws.com/AKIAJC5RLADLUMVRPFDQ.book-thumb-images/brown.jpg
Visual Object Oriented Programming,Margaret M. Burnett,762,131723979,02-01-1995,Programming,49,This first book on the union of two rapidly growing approaches to programming--visual programming and object technology--provides a window on a subject of increasing commercial importance. It is an introduction and reference for cutting-edge develope...,https://s3.amazonaws.com/AKIAJC5RLADLUMVRPFDQ.book-thumb-images/burnett.jpg
iOS in Practice,Bear P. Cahill,318,1617291269,11-01-2013,Mobile Technology,14,nan...,https://s3.amazonaws.com/AKIAJC5RLADLUMVRPFDQ.book-thumb-images/cahill.jpg
iPhone in Action,Christopher Allen,767,193398886X,12-01-2008,Web Development,5,"The iPhone explodes old ideas of a cell phone. Its native SDK offers a remarkable range of features including easy-to-build graphical objects, a unique navigation system, and a built-in database, all on a location-knowledgeable device. Websites and w...",https://s3.amazonaws.com/AKIAJC5RLADLUMVRPFDQ.book-thumb-images/callen.jpg
Silverlight 2 in Action,Chad A. Campbell,549,1933988428,31-10-2008,Microsoft .NET,23,"Microsoft describes Silverlight as a ""cross-browser, cross-platform plug-in for delivering the next generation of .NET based media experiences and rich interactive applications for the Web."" That's a really boring description for a really exciting ne...",https://s3.amazonaws.com/AKIAJC5RLADLUMVRPFDQ.book-thumb-images/campbell.jpg
"The Quick Python Book, Second Edition",Naomi R. Ceder,943,193518220X,01-01-2010,Python,16,"This revision of Manning's popular The Quick Python Book offers a clear, crisp introduction to the elegant Python programming language and its famously easy-to-read syntax. Written for programmers new to Python, this updated edition covers features c...",https://s3.amazonaws.com/AKIAJC5RLADLUMVRPFDQ.book-thumb-images/ceder.jpg
Internet and Intranet Applications with PowerBuilder 6,Tom Cervenka,990,1884777600,12-01-2000,PowerBuilder,5,"If you're a PowerBuilder programmer, Internet and Intranet Applications with PowerBuilder 6 is your ticket to learning Web.PB and related technologies. The book covers everything you need to know to build web browser and server programs with the Powe...",https://s3.amazonaws.com/AKIAJC5RLADLUMVRPFDQ.book-thumb-images/cervenka.jpg
Practical Methods for Your Year 2000 Problem,Robert Chapman,562,188477752X,01-01-1998,Business,42,"Practical Methods for Your Year 2000 Problem gives the Year 2000 project team a step-by-step methodology for addressing the Year 2000 problem. By seeking to minimize the amount of work to be performed, and thus maximize the probability of having a su...",
Mobile Agents,William R. Cockayne and Michael Zyda,217,1884777368,03-01-1997,Internet,7,Mobile Agents is the first book to give the reader the ability to create and use powerful mobile agents on the Internet. The book presents the reality of today's agent technologies and the future that this technology promises. It teaches how to creat...,https://s3.amazonaws.com/AKIAJC5RLADLUMVRPFDQ.book-thumb-images/cockayne.jpg
Spring Dynamic Modules in Action,Arnaud Cogoluegnes,814,1935182307,09-04-2010,Java,2,"OSGi is increasingly familiar to Java coders working in distributed environments, but the tools required to implement OSGi-based systems have been slow to develop. Spring Dynamic Modules (Spring DM) is a framework designed to make it easy to build Sp...",https://s3.amazonaws.com/AKIAJC5RLADLUMVRPFDQ.book-thumb-images/cogoluegnes.jpg
SQL Server 2008 Administration in Action,Rod Colledge,642,193398872X,08-01-2009,Microsoft,17,"The integrity and security of your database is crucial to your business. SQL Server 2008 is a massive and mature product with a very large feature set. As a SQL Server administrator, you must be equipped to handle myriad day-to-day tasks to keep your...",https://s3.amazonaws.com/AKIAJC5RLADLUMVRPFDQ.book-thumb-images/colledge.jpg
Android in Practice,Charlie Collins,510,1935182927,30-09-2011,Mobile Technology,18,"Android, Google's platform for mobile application development, provides powerful features, a robust SDK, and almost limitless possibilities. It's not hard to find the information you need to build your first Android app, but then what  If you want to...",https://s3.amazonaws.com/AKIAJC5RLADLUMVRPFDQ.book-thumb-images/collins.jpg
Object Oriented Perl,Damian Conway,457,1884777791,08-01-1999,Object-Oriented Programming,39,Object Oriented Perl is designed to provide anyone who is familiar with the basics of regular Perl programming with a complete introduction to the object-oriented features of Perl. The book moves from the very simplest applications through advanced a...,https://s3.amazonaws.com/AKIAJC5RLADLUMVRPFDQ.book-thumb-images/conway.jpg
GWT in Practice,Robert Cooper,741,1933988290,04-01-2008,Web Development,1,"If you   re a web developer, you already know that you can use Ajax to add rich, user-friendly, dynamic features to your applications. With the Google Web Toolkit (GWT), a new Ajax tool from Google that automatically converts Java to JavaScript, you ...",https://s3.amazonaws.com/AKIAJC5RLADLUMVRPFDQ.book-thumb-images/cooper.jpg
Ajax in Action,Dave Crane,632,1932394613,10-01-2005,XML,7,Web users are getting tired of the traditional web experience. They get frustrated losing their scroll position; they get annoyed waiting for refresh; they struggle to reorient themselves on every new page. And the list goes on. With asynchronous Jav...,https://s3.amazonaws.com/AKIAJC5RLADLUMVRPFDQ.book-thumb-images/crane.jpg
Ajax in Practice,Dave Crane,713,1932394990,06-01-2007,Web Development,5,"Ajax gives web developers the potential to create rich user-centered Internet applications. But Ajax also adds a new level of complexity and sophistication to those applications. Ajax in Practice tackles Ajax head-on, providing countless hands-on tec...",https://s3.amazonaws.com/AKIAJC5RLADLUMVRPFDQ.book-thumb-images/crane2.jpg
Prototype and Scriptaculous in Action,Dave Crane,453,1933988037,04-01-2007,Web Development,26,"Common Ajax tasks should be easy, and with Prototype and Scriptaculous they are. Prototype and Scriptaculous are libraries of reusable JavaScript code that simplify Ajax development. Prototype provides helpful methods and objects that extend JavaScri...",https://s3.amazonaws.com/AKIAJC5RLADLUMVRPFDQ.book-thumb-images/crane3.jpg
POJOs in Action,Chris Richardson,733,1932394583,01-01-2006,Java,19,"There is agreement in the Java community that EJBs often introduce more problems than they solve. Now there is a major trend toward lightweight technologies such as Hibernate, Spring, JDO, iBATIS, and others, all of which allow the developer to work ...",https://s3.amazonaws.com/AKIAJC5RLADLUMVRPFDQ.book-thumb-images/crichardson.jpg
Data Munging with Perl,David Cross,833,1930110006,01-01-2001,Perl,36,"Your desktop dictionary may not include it, but 'munging' is a common term in the programmer's world. Many computing tasks require taking data from one computer system, manipulating it in some way, and passing it to another. Munging can mean manipula...",https://s3.amazonaws.com/AKIAJC5RLADLUMVRPFDQ.book-thumb-images/cross.jpg
Hello! HTML5 & CSS3,Rob Crowther,841,1935182897,17-10-2012,Internet,4,"HTML and CSS are the foundation of the web, and HTML5 and CSS3 are the latest standards. If you build web pages, mobile apps, or do any type of development at all, you'll have to learn HTML5 and CSS3, so why not start now  Quick and Easy HTML5 and CS...",https://s3.amazonaws.com/AKIAJC5RLADLUMVRPFDQ.book-thumb-images/crowther.jpg
Seam in Action,Dan Allen,958,1933988401,08-01-2008,Java,26,"Seam is an exciting new application framework based on the Java EE platform that you can use to build rich, web-based business applications. Seam is rapidly capturing the interest of Java enterprise developers because of its focus on simplicity, ease...",https://s3.amazonaws.com/AKIAJC5RLADLUMVRPFDQ.book-thumb-images/dallen.jpg
Wicket in Action,Martijn Dashorst,122,1932394982,08-01-2008,Web Development,33,"Wicket bridges the mismatch between the web's stateless protocol and Java's OO model. The component-based Wicket framework shields you from the HTTP under a web app so you can concentrate on business problems instead of the plumbing code. In Wicket, ...",https://s3.amazonaws.com/AKIAJC5RLADLUMVRPFDQ.book-thumb-images/dashorst.jpg
Open Source SOA,Jeff Davis,386,1933988541,05-01-2009,Java,29,"Service Oriented Architecture, or SOA, has become embraced by many organizations as a means of improving reusability of software assets; providing better alignment between business and IT; and, increasing agility for responding to demands in the mark...",https://s3.amazonaws.com/AKIAJC5RLADLUMVRPFDQ.book-thumb-images/davis.jpg
Struts 2 in Action,Donald Brown,748,193398807X,05-01-2008,Java,40,"The original Struts project revolutionized Java web development and its rapid adoption resulted in the thousands of Struts-based applications deployed worldwide. Keeping pace with new ideas and trends, Apache Struts 2 has emerged as the product of a ...",https://s3.amazonaws.com/AKIAJC5RLADLUMVRPFDQ.book-thumb-images/dbrown.jpg
Essential Guide to Peoplesoft Development and Customization,Tony DeLia,101,1884777929,08-01-2000,Client-Server,19,"The Essential Guide to PeopleSoft Development and Customization is an exhaustive, as well as practical, guide that covers PeopleSoft 7.5 and many new features in release 8.0. Both novice and experienced programmers will benefit from the detailed cove...",https://s3.amazonaws.com/AKIAJC5RLADLUMVRPFDQ.book-thumb-images/delia.jpg
.NET Multithreading,Alan Dennis,968,1930110545,11-01-2002,Microsoft .NET,49,"If you need high performance, or a rich user experience, you should consider multithreading. With .NET you can develop stable and robust multithreaded applications with minimal effort. .NET Multithreading teaches the basics in an understandable and p...",https://s3.amazonaws.com/AKIAJC5RLADLUMVRPFDQ.book-thumb-images/dennis.jpg
SCWCD Exam Study Kit Second Edition,Hanumant Deshmukh,545,1932394389,05-01-2005,Internet,36,"With the tremendous penetration of J2EE in the enterprise, passing the Sun Certified Web Component Developer exam has become an important qualification for Java and J2EE developers. To pass the SCWCD exam (Number: 310-081) you need to answer 69 quest...",https://s3.amazonaws.com/AKIAJC5RLADLUMVRPFDQ.book-thumb-images/deshmukh2.jpg
Spring Roo in Action,Ken Rimple,147,193518296X,13-04-2012,Java,49,nan...,https://s3.amazonaws.com/AKIAJC5RLADLUMVRPFDQ.book-thumb-images/rimple.jpg
SOA Governance in Action,Jos Dirksen,458,1617290270,27-07-2012,java,26,nan...,https://s3.amazonaws.com/AKIAJC5RLADLUMVRPFDQ.book-thumb-images/dirksen.jpg
RSS and Atom in Action,Dave Johnson,901,1932394494,03-01-2006,Internet,16,RSS and Atom in Action is organized into two parts. The first part introduces the blog technologies of newsfeed formats and publishing protocols   the building blocks. The second part shows how to put to those blocks together to assemble interesting ...,https://s3.amazonaws.com/AKIAJC5RLADLUMVRPFDQ.book-thumb-images/dmjohnson.jpg
