title,author,price,isbn,publishedDate,categoryName,stockQuantity,description,coverImageUrl
Client/Server Yellow Pages,Compiled,762,1884777082,01-01-1995,Client-Server,26,"This unique guide covers software products and vendors active in the client/server marketplace. Over 200 products and over 250 vendors are included. To help you search for the item of interest to you, software products are grouped in categories (e.g....",https://s3.amazonaws.com/AKIAJC5RLADLUMVRPFDQ.book-thumb-images/lewis.jpg
Object Oriented Application Frameworks,Ted Lewis,836,1884777066,04-01-1995,Object-Oriented Programming,10,"Frameworks are object-oriented programming environments for vertical application areas. This book is the first to survey this exciting new technology, its concepts, and practical applications. Considered the next step in the evolution of OOP, framewo...",https://s3.amazonaws.com/AKIAJC5RLADLUMVRPFDQ.book-thumb-images/lewis2.jpg
Tapestry in Action,Howard M. Lewis Ship,830,1932394117,03-01-2004,Java,44,"Many web development frustrations can be traced back to the underlying stateless HTTP protocol. Tapestry represents state and behavior as standard Java objects, methods and properties. That means state management and multithreading are handled by the...",https://s3.amazonaws.com/AKIAJC5RLADLUMVRPFDQ.book-thumb-images/lewisship.jpg
WebWork in Action,Patrick Lightbody,637,1932394532,09-01-2005,internet,40,"The WebWork framework implements a simple command/ business-logic and MVC design. It provides out-of-the-box functionality developers need to build well-designed applications that are modular and reusable. Written by its two primary developers, WebWo...",https://s3.amazonaws.com/AKIAJC5RLADLUMVRPFDQ.book-thumb-images/lightbody.jpg
MacRuby in Action,Brendan G. Lim with Jerry Cheung,153,1935182498,04-11-2012,Programming,25,nan...,https://s3.amazonaws.com/AKIAJC5RLADLUMVRPFDQ.book-thumb-images/lim.jpg
Erlang and OTP in Action,Martin Logan,868,1933988789,16-11-2010,Programming,18,Concurrent programming has become a required discipline for all programmers. Multi-core processors and the increasing demand for maximum performance and scalability in mission-critical applications have renewed interest in functional languages like E...,https://s3.amazonaws.com/AKIAJC5RLADLUMVRPFDQ.book-thumb-images/logan.jpg
SharePoint 2007 Developer's Guide to Business Data Catalog,Brett Lonsdale,843,1933988819,09-09-2009,Microsoft .NET,37,"The data locked in your organization's systems and databases is a precious   and sometimes untapped   resource. The SharePoint Business Data Catalog makes it easy to gather, analyze, and report on data from multiple sources, through SharePoint. Using...",https://s3.amazonaws.com/AKIAJC5RLADLUMVRPFDQ.book-thumb-images/lonsdale.jpg
Doing IT Right,Harold Lorin,273,133964256,12-01-1995,Business,5,"Only a handful of Information Technology leaders understand the complete range of IT issues, from basic technology to business strategy. One of them, Harold Lorin, has written a definitive guide for the IT decision maker, the technologist, and the sy...",https://s3.amazonaws.com/AKIAJC5RLADLUMVRPFDQ.book-thumb-images/lorin.jpg
Adobe AIR in Action,Joey Lott,559,1933988487,07-01-2008,Web Development,39,"Many technologies promise to put features of desktop applications on the Web; Adobe AIR, instead, brings the flexibility, convenience, and ease of Web development to the desktop. The AIR is a cross-platform runtime environment that allows Web develop...",https://s3.amazonaws.com/AKIAJC5RLADLUMVRPFDQ.book-thumb-images/lott.jpg
Ant in Action,Steve Loughran,312,193239480X,07-01-2007,Java,8,"Ant in Action is a complete guide to using Ant to build, test, redistribute and deploy Java applications. A retitled second edition of the bestselling and award-winning Java Development with Ant, this book contains over 50% new content including:    ...",https://s3.amazonaws.com/AKIAJC5RLADLUMVRPFDQ.book-thumb-images/loughran.jpg
Restlet in Action,Jerome Louvel,888,193518234X,26-09-2012,Internet,41,"REpresentational State Transfer, better known as REST, is the architectural style that governs the web's request-and-response resource model. The open source Restlet Framework provides a simple, powerful Java-based API to implement RESTful web applic...",https://s3.amazonaws.com/AKIAJC5RLADLUMVRPFDQ.book-thumb-images/louvel.jpg
iText in Action,Bruno Lowagie,707,1932394796,11-01-2006,Web Development,11,"Say you need a tool to add dynamic or interactive features to a PDF file and you decide to search on Google for ""Java PDF."" What do you think you'd find  Why, at the top of the page you'd find ""iText,"" of course. A leading tool for programmatic creat...",https://s3.amazonaws.com/AKIAJC5RLADLUMVRPFDQ.book-thumb-images/lowagie.jpg
"iText in Action, Second Edition",Bruno Lowagie,502,1935182617,22-11-2010,Java,23,"Far from a static document presentation format, PDF supports many dynamic or interactive features. With iText, the leading tool creating and manipulating PDF programmatically, you can transform PDF documents into live, interactive applications quickl...",https://s3.amazonaws.com/AKIAJC5RLADLUMVRPFDQ.book-thumb-images/lowagie2.jpg
Power-3D,Kyle Lussier,849,138412146,10-01-1997,Computer Graphics,6,"In the past, serious computer graphics programmers generally had to use ""industrial strength"" workstation hardware and software. Now, advanced graphics capabilities have become available in the PC arena. Whether you're a programmer, 3D enthusiast, C+...",https://s3.amazonaws.com/AKIAJC5RLADLUMVRPFDQ.book-thumb-images/lussier.jpg
SNA and TCP/IP Enterprise Networking,Daniel C. Lynch,376,131271687,09-01-1997,Software Engineering,47,"Most textbooks concentrate on presenting the theory, concepts, and products, with examples of implementations in some cases. The distinctive quality of SNA and TCP/IP Enterprise Networking is in its structure. It answers not only ""What "", ""Why "", and...",https://s3.amazonaws.com/AKIAJC5RLADLUMVRPFDQ.book-thumb-images/lynch.jpg
Subversion in Action,Jeffrey Machols,940,1932394478,12-01-2004,Java,9,"A new-generation version control tool, Subversion is replacing the current open source standard, CVS. With Subversion's control components you can simplify and streamline the management of your code way beyond what's possible with CVS. For example, w...",https://s3.amazonaws.com/AKIAJC5RLADLUMVRPFDQ.book-thumb-images/machols.jpg
Minimal Perl,Tim Maher,913,1932394508,07-01-2006,Perl,26,"Perl is a complex language that can be difficult to master. Perl advocates boast that ""There's More Than One Way To Do It"", but do you really want to learn several ways of saying the same thing to a computer     To make Perl more accessible, Dr. Tim ...",https://s3.amazonaws.com/AKIAJC5RLADLUMVRPFDQ.book-thumb-images/maher.jpg
Distributed Programming with Java,Qusay H. Mahmoud,990,1884777651,09-01-1999,Java,19,"Maybe you've seen some books on Java RMI, others on Java and CORBA and still others on mobile agents. Finally, here's one book that covers ALL the popular approaches for developing distributed applications. What's more, the author makes it easy to co...",https://s3.amazonaws.com/AKIAJC5RLADLUMVRPFDQ.book-thumb-images/mahmoud.jpg
Comprehensive Networking Glossary and Acronym Guide,Gary Scott Malkin,758,013319955X,01-01-1995,Internet,45,"This glossary offers a complete collection of technical terms and acronyms used in the networking industry. It covers general networking terminology, the specific terminology used in the Internet, and terms and acronyms specific to AppleTalk, IP, IPX...",https://s3.amazonaws.com/AKIAJC5RLADLUMVRPFDQ.book-thumb-images/malkin.jpg
JavaServer Faces in Action,Kito D. Mann,625,1932394125,11-01-2004,Java,23,"JavaServer Faces helps streamline your web development through the use of UI components and events (instead of HTTP requests and responses). JSF components (buttons, text boxes, checkboxes, data grids, etc.) live between user requests, which eliminat...",https://s3.amazonaws.com/AKIAJC5RLADLUMVRPFDQ.book-thumb-images/mann.jpg
LINQ in Action,Fabrice Marguerie,991,1933988169,01-01-2008,Microsoft .NET,33,"LINQ, Language INtegrated Query, is a new extension to the Visual Basic and C# programming languages designed to simplify data queries and database interaction. It addreses O/R mapping issues by making query operations like SQL statements part of the...",https://s3.amazonaws.com/AKIAJC5RLADLUMVRPFDQ.book-thumb-images/marguerie.jpg
Internet BBSs,Richard Scott Mark,162,132869985,10-01-1996,Internet,9,"OK, so you use the Internet. You've surfed some Web sites and maybe sent e-mail. But, chances are, you've overlooked the rich and really personal dimension of the Internet represented by the explosive growth of Internet BBSs. That's because up till n...",https://s3.amazonaws.com/AKIAJC5RLADLUMVRPFDQ.book-thumb-images/mark.jpg
Algorithms of the Intelligent Web,Haralambos Marmanis,173,1933988665,29-05-2009,Web Development,25,"Web 2.0 applications are best known for providing a rich user experience, but the parts you can't see are just as important   and impressive. Many Web 2.0 applications use powerful techniques to process information intelligently and offer features ba...",https://s3.amazonaws.com/AKIAJC5RLADLUMVRPFDQ.book-thumb-images/marmanis.jpg
JUnit in Action,Vincent Massol with Ted Husted,826,1930110995,10-01-2003,Java,2,Developers in the know are switching to a new testing strategy - unit testing - which interleaves coding and testing in an integrated way. This has proven to be a powerful combination that results in better designed software with fewer defects and fa...,https://s3.amazonaws.com/AKIAJC5RLADLUMVRPFDQ.book-thumb-images/massol.jpg
Tika in Action,Chris A. Mattmann,399,1935182854,12-01-2011,Java,18,nan...,https://s3.amazonaws.com/AKIAJC5RLADLUMVRPFDQ.book-thumb-images/mattmann.jpg
Ruby in Practice,Jeremy McAnally,165,1933988479,03-01-2009,Programming,16,"Like Ruby itself, Ruby in Practice will make you more productive. The book shows you practical techniques and strategies for small projects and large-scale environments. A cookbook-style reference, it gives you concrete examples of systems integratio...",https://s3.amazonaws.com/AKIAJC5RLADLUMVRPFDQ.book-thumb-images/mcanally.jpg
Inside LotusScript,Joe McGinn,350,1884777481,11-01-1997,Business,18,"At last, here's a book that tells you everything that isn't in the Lotus Notes manuals. It's designed to make it easy for you to develop Notes and Domino Web applications by providing advanced LotusScript code for direct use in your programs. It emph...",https://s3.amazonaws.com/AKIAJC5RLADLUMVRPFDQ.book-thumb-images/mcginn.jpg
Maximum MIDI,Paul Messick,986,1884777449,08-01-1997,Programming,37,"Maximum MIDI shows you how to build world-class MIDI programs that can play music using computer sound cards or external keyboard instruments, teach music theory and technique, add music to games and allow musicians to record, edit, play and print co...",https://s3.amazonaws.com/AKIAJC5RLADLUMVRPFDQ.book-thumb-images/messick.jpg
Planning and Managing ATM Networks,Daniel Minoli,597,132621894,06-01-1997,Client-Server,39,"Not only is ATM the best available means to greater transmission capacity, it has also the best potential to meet the needs for sophisticated service control, distributed network oversight, efficient operation, and improved flexibility.    Planning a...",https://s3.amazonaws.com/AKIAJC5RLADLUMVRPFDQ.book-thumb-images/minoli.jpg
Client/Server Applications on ATM Networks,Daniel Minoli,101,137353006,01-01-1997,Client-Server,25,"Today, to meet the surging demands of client/server company-wide processes--distributed cooperative computing, business/scientific imaging, video conferencing, multimedia, distance learning and many more--corporations are finding they must extend hig...",https://s3.amazonaws.com/AKIAJC5RLADLUMVRPFDQ.book-thumb-images/minoli2.jpg
JavaFX in Action,Simon Morris,347,1933988991,10-01-2009,Java,36,"Whether you're writing a desktop app, spinning up a rich web interface, or pushing code to a mobile phone, graphics programming should be easier, and more fun, than it currently is. New technologies and devices   not to mention higher user expectatio...",https://s3.amazonaws.com/AKIAJC5RLADLUMVRPFDQ.book-thumb-images/morris.jpg
Entity Framework 4 in Action,Stefano Mostarda,930,1935182188,05-01-2011,Microsoft .NET,44,"To be successful, any significant application has to manage the flow of data effectively. Microsoft   s approach to data has taken another major step forward with the new Entity Framework for .NET. The Entity Framework starts with ideas from Object R...",https://s3.amazonaws.com/AKIAJC5RLADLUMVRPFDQ.book-thumb-images/mostarda.jpg
ASP.NET 2.0 Web Parts in Action,Darren Neimke,131,193239477X,09-01-2006,Microsoft,36,"The static Web is going out of style. Its click-and-wait user experience is giving way to dynamic personalized content and intuitive interactions. With ASP 2.0, a web developer can compose a page out of separate working parts ""Web Parts"" that indepen...",https://s3.amazonaws.com/AKIAJC5RLADLUMVRPFDQ.book-thumb-images/neimke.jpg
Sass and Compass in Action,Wynn Netherland,479,1617290149,26-07-2013,Web Development,16,"Cascading Style Sheets paint the web as the user sees it, and for fifteen years, we've been painting the web by hand. Sass and Compass extend standard CSS to give you more flexibility and the option to simplify or automate many tedious tasks. Think o...",https://s3.amazonaws.com/AKIAJC5RLADLUMVRPFDQ.book-thumb-images/netherland.jpg
Core OWL 5.0,Ted Neward,326,1884777503,12-01-1997,Programming,8,"Are you an OWL programmer frustrated by shallow coverage of OWL topics in current documentation  Core OWL 5.0 takes you well beyond the ""Hello, world"" level. Concentrating on the central features and classes of the OWL framework, this book dives unde...",https://s3.amazonaws.com/AKIAJC5RLADLUMVRPFDQ.book-thumb-images/neward.jpg
Advanced OWL 5.0,Ted Neward,502,1884777465,01-01-1998,Programming,20,"Are you an OWL programmer who'd like to know more about the new, largely undocumented features of OWL 5.0  Here's a book that covers advanced ways to make the OWL library do those tricky things you thought weren't possible. You'll get a long, exhaust...",https://s3.amazonaws.com/AKIAJC5RLADLUMVRPFDQ.book-thumb-images/neward2.jpg
Server-Based Java Programming,Ted Neward,494,1884777716,06-01-2000,Java,14,"Java on the server is here to stay. Whether you're using J2EE or writing your own, you will need to understand the fundamental concepts of server-based Java. Server-Based Java Programming teaches those concepts of Java that underlie the J2EE APIs and...",https://s3.amazonaws.com/AKIAJC5RLADLUMVRPFDQ.book-thumb-images/neward3.jpg
SQL Server MVP Deep Dives,Contributions from 53 SQL Server MVPs,934,1935182048,11-01-2009,Microsoft .NET,47,"This is no ordinary SQL Server book. In SQL Server MVP Deep Dives, the world's leading experts and practitioners offer a masterful collection of techniques and best practices for SQL Server development and administration. 53 MVPs each pick an area of...",https://s3.amazonaws.com/AKIAJC5RLADLUMVRPFDQ.book-thumb-images/nielsen.jpg
SQL Server MVP Deep Dives,Contributions from 53 SQL Server MVPs; Edited by Paul Nielsen,630,9.78E+12,15-11-2009,Microsoft .NET,44,"This is no ordinary SQL Server book. In SQL Server MVP Deep Dives, the world's leading experts and practitioners offer a masterful collection of techniques and best practices for SQL Server development and administration. 53 MVPs each pick an area of...",https://s3.amazonaws.com/AKIAJC5RLADLUMVRPFDQ.book-thumb-images/nielsenaw.jpg
SQL Server MVP Deep Dives,Paul Nielsen,839,9.78E+12,11-01-2009,Microsoft .NET,34,nan...,https://s3.amazonaws.com/AKIAJC5RLADLUMVRPFDQ.book-thumb-images/nielsonaw.jpg
PostGIS in Action,Regina O. Obe,717,1935182269,04-11-2011,Internet,10,"Whether you're canvassing a congressional district, managing a sales region, mapping city bus schedules, or analyzing local cancer rates, thinking spatially opens up limitless possibilities for database users. PostGIS, a freely available open-source ...",https://s3.amazonaws.com/AKIAJC5RLADLUMVRPFDQ.book-thumb-images/obe.jpg
Programming Mac OS X,Kevin O'Malley,830,1930110855,01-01-2003,Programming,10,"A guide for UNIX developers who want accurate information on getting up to speed with Mac OS X and its software development environment, this book provides programmers all the information they need to understand and use the operating system, its deve...",https://s3.amazonaws.com/AKIAJC5RLADLUMVRPFDQ.book-thumb-images/omalley.jpg
The Art of Unit Testing,Roy Osherove,545,1933988274,05-01-2009,Software Engineering,50,"Unit testing, done right, can mean the diff erence between a failed project and a successful one, between a maintainable code base and a code base that no one dares touch, and between getting home at 2 AM or getting home in time for dinner, even befo...",https://s3.amazonaws.com/AKIAJC5RLADLUMVRPFDQ.book-thumb-images/osherove.jpg
Mahout in Action,Sean Owen,147,1935182684,10-05-2011,Java,45,nan...,https://s3.amazonaws.com/AKIAJC5RLADLUMVRPFDQ.book-thumb-images/owen.jpg
ASP.NET MVC in Action,Jeffrey Palermo,734,1933988622,09-01-2009,Microsoft .NET,45,"ASP.NET MVC implements the Model-View-Controller pattern on the ASP.NET runtime. It works well with open source projects like NHibernate, Castle, StructureMap, AutoMapper, and MvcContrib.    ASP.NET MVC in Action is a guide to pragmatic MVC-based web...",https://s3.amazonaws.com/AKIAJC5RLADLUMVRPFDQ.book-thumb-images/palermo.jpg
ASP.NET MVC 2 in Action,Jeffrey Palermo,721,193518279X,06-01-2010,Microsoft .NET,48,"The future of high-end web development on the Microsoft platform, ASP.NET MVC 2 provides clear separation of data, interface, and logic and radically simplifies tedious page and event lifecycle management. And since it's an evolution of ASP.NET, you ...",https://s3.amazonaws.com/AKIAJC5RLADLUMVRPFDQ.book-thumb-images/palermo2.jpg
ASP.NET MVC 4 in Action,Jeffrey Palermo,759,1617290416,25-05-2012,Microsoft .NET,3,"A successful ASP.NET application needs to accomplish its functional goals, provide a comfortable user experience, and be easy to deploy, maintain, and extend. ASP.NET MVC is a development framework designed around these principles. It provides the st...",https://s3.amazonaws.com/AKIAJC5RLADLUMVRPFDQ.book-thumb-images/palermo3.jpg
EJB 3 in Action,Debu Panda,472,1933988347,04-01-2007,Java,2,"EJB 2 is widely used but it comes at a cost   procedural, redundant code. EJB 3 is a different animal. By adopting a POJO programming model and Java 5 annotations, it dramatically simplifies enterprise development. A cool new feature, its Java Persis...",https://s3.amazonaws.com/AKIAJC5RLADLUMVRPFDQ.book-thumb-images/panda.jpg
"EJB 3 in Action, Second Edition",Debu Panda,864,1935182994,04-07-2014,Java,15,"The EJB 3 framework was a major advancement for Java EE developers, providing a consistent, easy to use model to create and extend applications. EJB 3 incorporates a POJO programming model and Java 5 annotations, along with the Java Persistence API (...",https://s3.amazonaws.com/AKIAJC5RLADLUMVRPFDQ.book-thumb-images/panda2.jpg
Explorer's Guide to the Semantic Web,Thomas B. Passin,598,1932394206,06-01-2004,Internet,22,"A complex set of extensions to the World Wide Web, the Semantic Web will make data and services more accessible to computers and useful to people. Some of these extensions are being deployed, and many are coming in the next years. This is the only bo...",https://s3.amazonaws.com/AKIAJC5RLADLUMVRPFDQ.book-thumb-images/passin.jpg
Practical LotusScript,Anthony Patton,960,1884777767,05-01-1999,Business,26,"Practical LotusScript covers the LotusScript programming language like no other book on the market. It starts with the core languge and proceeds to cover the specifics of Lotus Notes in complete detail. Advanced topics include report generation, work...",https://s3.amazonaws.com/AKIAJC5RLADLUMVRPFDQ.book-thumb-images/patton.jpg
Domino Development with Java,Anthony Patton,602,1930110049,08-01-2000,Java,26,Domino Development with Java takes the mysteries out of using the Java programming language within the Domino development environment. It provides a solid foundation for working utilization of the Java programming language in the Domino Application S...,https://s3.amazonaws.com/AKIAJC5RLADLUMVRPFDQ.book-thumb-images/patton2.jpg
Windows PowerShell in Action,Bruce Payette,396,1932394907,02-01-2007,Microsoft,8,"Windows has an easy-to-use interface, but if you want to automate it, life can get hard. That is, unless you use PowerShell, an elegant new dynamic language from Microsoft designed as an all-purpose Windows scripting tool. PowerShell lets you script ...",https://s3.amazonaws.com/AKIAJC5RLADLUMVRPFDQ.book-thumb-images/payette.jpg
"Windows PowerShell in Action, Second Edition",Bruce Payette,997,1935182137,15-05-2011,Microsoft,39,"Windows PowerShell transformed the way administrators and developers interact with Windows. PowerShell, an elegant dynamic language from Microsoft, lets you script administrative tasks and control Windows from the command line. Because it's a full-fe...",https://s3.amazonaws.com/AKIAJC5RLADLUMVRPFDQ.book-thumb-images/payette2.jpg
"Silverlight 4 in Action, Revised Edition",Pete Brown,102,1935182374,10-04-2010,Microsoft .NET,33,"Anyone who has gotten a taste of what it can do knows that Silverlight represents an entirely new level of rich web interface technology for Microsoft developers. With Silverlight, developers can use JavaScript, C#, and other languages to build user-...",https://s3.amazonaws.com/AKIAJC5RLADLUMVRPFDQ.book-thumb-images/pbrown.jpg
Silverlight 5 in Action,Pete Brown,436,1617290319,06-01-2012,Microsoft,31,nan...,https://s3.amazonaws.com/AKIAJC5RLADLUMVRPFDQ.book-thumb-images/pbrown2.jpg
Hibernate Quickly,Patrick Peak,146,1932394419,08-01-2005,Java,48,"Positioned as a layer between the application and the database, Hibernate is a powerful object/relational persistence and query service for Java. It takes care of automating a tedious task: the manual bridging of the gap between object oriented code ...",https://s3.amazonaws.com/AKIAJC5RLADLUMVRPFDQ.book-thumb-images/peak.jpg
Generative Art,Matt Pearson,660,1935182625,30-06-2011,Algorithmic Art,34,nan...,https://s3.amazonaws.com/AKIAJC5RLADLUMVRPFDQ.book-thumb-images/pearson.jpg
Windows Phone 7 in Action,Timothy Binkley-Jones,219,1617290092,21-08-2012,Mobile Technology,11,"Windows Phone 7 is a major shift in the way Microsoft developers design, develop, and sell mobile apps. By leveraging a trio of established technologies-Silverlight, XNA, and C#   developers can blend what they already know about Windows development ...",https://s3.amazonaws.com/AKIAJC5RLADLUMVRPFDQ.book-thumb-images/perga.jpg
Lift in Action,Timothy Perrett,352,1935182803,18-11-2011,Java,4,nan...,https://s3.amazonaws.com/AKIAJC5RLADLUMVRPFDQ.book-thumb-images/perrett.jpg
Web Development with Apache and Perl,Theo Petersen,574,1930110065,04-01-2002,Perl,18,"Open source tools provide a powerful and flexible environment for web development and maintenance. If your site has complex business rules or server logic, then you need more than just an interface builder. You need a strong application language with...",https://s3.amazonaws.com/AKIAJC5RLADLUMVRPFDQ.book-thumb-images/petersen.jpg
Real-World Functional Programming,Tomas Petricek with Jon Skeet,569,1933988924,12-01-2009,Microsoft .NET,5,"Functional programming languages are good at expressing complex ideas in a succinct, declarative way. Functional concepts such as ""immutability"" and ""function values"" make it easier to reason about code   as well as helping with concurrency. The new ...",https://s3.amazonaws.com/AKIAJC5RLADLUMVRPFDQ.book-thumb-images/petricek.jpg
Machine Learning in Action,Peter Harrington,220,1617290181,04-04-2012,Software Engineering,4,"It's been said that data is the new ""dirt""   the raw material from which and on which you build the structures of the modern world. And like dirt, data can seem like a limitless, undifferentiated mass. The ability to take raw data, access it, filter ...",https://s3.amazonaws.com/AKIAJC5RLADLUMVRPFDQ.book-thumb-images/pharrington.jpg
Dependency Injection,Dhanji R. Prasanna,968,193398855X,08-01-2009,Microsoft .NET,7,"In object-oriented programming, a central program normally controls other objects in a module, library, or framework. With dependency injection, this pattern is inverted   a reference to a service is placed directly into the object which eases testin...",https://s3.amazonaws.com/AKIAJC5RLADLUMVRPFDQ.book-thumb-images/prasanna.jpg
Understanding Enterprise SOA,Eric Pulier and Hugh Taylor,933,1932394591,11-01-2005,Theory,24,"Understanding Enterprise SOA gives technologists and business people an invaluable and until now missing integrated picture of the issues and their interdependencies. You will learn how to think in a big way, moving confidently between technology- an...",https://s3.amazonaws.com/AKIAJC5RLADLUMVRPFDQ.book-thumb-images/pulier.jpg
Open-Source ESBs in Action,Tijs Rademakers,202,1933988215,09-01-2008,Business,31,"The need for enterprise integration is widespread for the simple reason that businesses require independent applications to exchange information with each other. A CRM application must know about the order history of a customer, but that history is s...",https://s3.amazonaws.com/AKIAJC5RLADLUMVRPFDQ.book-thumb-images/rademakers.jpg
Activiti in Action,Tijs Rademakers,496,1617290122,07-12-2012,Software Engineering,7,nan...,https://s3.amazonaws.com/AKIAJC5RLADLUMVRPFDQ.book-thumb-images/rademakers2.jpg
